<?xml version="1.0" encoding="UTF-8"?>
<!--
/**
 * Copyright Â© 2015 Magento. All rights reserved.
 * See COPYING.txt for license details.
 */
-->
<xs:schema xmlns:xs="http://www.w3.org/2001/XMLSchema">
    <xs:element name="view">
        <xs:complexType>
            <xs:choice maxOccurs="unbounded">
                <xs:element name="vars" maxOccurs="unbounded">
                    <xs:complexType>
                        <xs:sequence>
                            <xs:element name="var" maxOccurs="unbounded">
                                <xs:complexType>
                                    <xs:simpleContent>
                                        <xs:extension base="xs:string">
                                            <xs:attribute name="name" type="xs:string" use="required"/>
                                        </xs:extension>
                                    </xs:simpleContent>
                                </xs:complexType>
                            </xs:element>
                        </xs:sequence>
                        <xs:attribute name="module" type="xs:string" use="required"/>
                    </xs:complexType>
                    <xs:unique name="varNameIdentifier">
                        <xs:selector xpath="var"/>
                        <xs:field xpath="@name"/>
                    </xs:unique>
                </xs:element>
                <xs:element name="exclude" minOccurs="0" maxOccurs="1" type="excludeType"/>
            </xs:choice>
        </xs:complexType>
        <xs:unique name="varsModuleIdentifier">
            <xs:selector xpath="vars"/>
            <xs:field xpath="@module"/>
        </xs:unique>
    </xs:element>
    <xs:complexType name="excludeType">
        <xs:sequence>
            <xs:element name="item" type="itemType" maxOccurs="unbounded"/>
        </xs:sequence>
    </xs:complexType>
    <xs:complexType name="itemType">
        <xs:simpleContent>
            <xs:extension base="xs:string">
                <xs:attribute name="type" use="required">
                    <xs:simpleType>
                        <xs:restriction base="xs:string">
                            <xs:enumeration value="file"/>
                            <xs:enumeration value="directory"/>
                        </xs:restriction>
                    </xs:simpleType>
                </xs:attribute>
            </xs:extension>
        </xs:simpleContent>
    </xs:complexType>
</xs:schema>
